{
  "$id": "https://arky.foundation/schemas/core/kernel-v1.json",
  "$schema": "https://json-schema.org/draft/2020-12/schema",
  "type": "object",
  "additionalProperties": false,
  "required": ["scope", "actor", "intent", "measure", "consequence", "cid", "sig"],
  "properties": {
    "scope": {"type": "string"},
    "actor": {"type": "string"},
    "intent": {
      "type": "object",
      "additionalProperties": false,
      "required": ["do"],
      "properties": {
        "do": {"type": "string", "minLength": 1},
        "budget": {"$ref": "#/$defs/Amount"},
        "rate": {"type": "string"},
        "geofence": {"type": "string"},
        "approvals": {"type": "array", "items": {"type": "string"}}
      }
    },
    "measure": {"type": "array", "minItems": 1, "items": {"$ref": "#/$defs/MeasureSpec"}},
    "consequence": {"type": "array", "minItems": 1, "items": {"$ref": "#/$defs/ConsequenceSpec"}},
    "clock": {"$ref": "#/$defs/ClockSpec"},
    "policy": {"$ref": "#/$defs/PolicyHints"},
    "locale": {"type": "string"},
    "prev": {"type": "string"},
    "cid": {"type": "string"},
    "nonce": {"type": "string"},
    "exp": {"type": "string", "format": "date-time"},
    "sig": {"type": "string"}
  },
  "$defs": {
    "Amount": {
      "type": "object",
      "additionalProperties": false,
      "required": ["value", "unit"],
      "properties": {"value": {"type": "number"}, "unit": {"type": "string"}}
    },
    "MeasureSpec": {
      "type": "object",
      "additionalProperties": false,
      "required": ["name", "assert"],
      "properties": {
        "name": {"type": "string"},
        "from": {"type": "string"},
        "window": {
          "type": "object",
          "additionalProperties": false,
          "properties": {
            "start": {"type": "string"},
            "end": {"type": "string"},
            "max_age": {"type": "string"}
          }
        },
        "assert": {"type": "string"},
        "profile": {"type": "string"},
        "require": {
          "type": "object",
          "additionalProperties": false,
          "properties": {
            "min_witnesses": {"type": "integer", "minimum": 0},
            "device_class": {"type": "array", "items": {"type": "string"}},
            "code": {"type": "array", "items": {"type": "string"}}
          }
        }
      }
    },
    "Verb": {
      "type": "object",
      "additionalProperties": false,
      "required": ["name", "args"],
      "properties": {"name": {"type": "string"}, "args": {"type": "object"}}
    },
    "Limits": {
      "type": "object",
      "additionalProperties": false,
      "properties": {
        "amount_max": {"$ref": "#/$defs/Amount"},
        "retries_max": {"type": "integer", "minimum": 0},
        "expiry": {"type": "string", "format": "date-time"}
      }
    },
    "ConsequenceSpec": {
      "type": "object",
      "additionalProperties": false,
      "required": ["if", "then"],
      "properties": {
        "if": {"type": ["string"]},
        "then": {"type": "array", "minItems": 1, "items": {"$ref": "#/$defs/Verb"}},
        "limits": {"$ref": "#/$defs/Limits"}
      }
    },
    "ClockSpec": {
      "type": "object",
      "additionalProperties": false,
      "properties": {
        "notarize": {"type": "array", "items": {"type": "string"}},
        "deadline": {"type": "string", "format": "date-time"},
        "ordering": {"type": "object", "properties": {"lamport": {"type": "integer", "minimum": 0}}, "additionalProperties": false}
      }
    },
    "PolicyHints": {
      "type": "object",
      "additionalProperties": false,
      "properties": {
        "rollback_window": {"type": "string"},
        "two_person": {"type": "boolean"},
        "quarantine_skew": {"type": "string"}
      }
    }
  }
}
