{
  "scope": "demo",
  "actor": "did:web:example.org",
  "intent": {
    "do": "arky:verb/pay@v1"
  },
  "measure": [
    {
      "name": "cpu",
      "assert": "cpu > 0.8"
    }
  ],
  "consequence": [
    {
      "if": "PASS",
      "then": [
        {
          "name": "pay",
          "args": {
            "amount": 100
          }
        }
      ]
    }
  ],
  "cid": "zQmWdqVHwn3XG8qjgf5s69dPY48PbfAzXfGUfjauMT6pEG5",
  "sig": "eyJhbGciOiJFZERTQSIsInR5cCI6IkpXUyIsImtpZCI6InRlc3Qta2V5LTIwMjUtMDEiLCJiNjQiOmZhbHNlLCJjcml0IjpbImI2NCJdfQ..woFccsxlo9IOTX3ii_paeW6rBcZymsnCdZR5laDpF_BnwrfzwdVk26fkRHVj_BIC-eMknowlCJQ5ZiZEtjMACQ"
}
